<?xml version="1.0" encoding="utf-8"?>
<personer
      xmlns="http://home.hvl.no/databaser"
      xmlns:xsi="http://www.w3.org/2001/XMLSchema-instance"
      xsi:schemaLocation="http://home.hvl.no/databaser personer.xsd">

  <person pnr="1">
    <fornavn>Ola</fornavn>
    <etternavn>Nordmann</etternavn>
    <barn>1</barn>
    <fodselsdato>1980-01-01</fodselsdato>
    <email>enkel@example.com</email>
  </person>

  <person pnr="1">
    <fornavn>Kari</fornavn>
    <etternavn>Svenske</etternavn>
    <fodselsdato>1993-08-23</fodselsdato>
    <email>enkel@example.com</email>
  </person>

</personer>